{
  "blueprint_version": "3.13",
  "latest_locked_section": 141,
  "latest_closed_milestone_id": "CAREER_OS_PERSONAL_V1_RECOVERY_AND_OPERATOR_LOCK_V1",
  "latest_closed_milestone_pr": 83,
  "current_phase": "SUPERVISED_PRODUCTION_V1 (ACTIVE_PRODUCTION_DOCTRINE; FIRST_PARTY_IDENTITY_RESOLUTION_V1_COMPLETED_BY_OPERATOR_BORA_ACCEPTED_PR82; CAREER_OS_PERSONAL_V1_RECOVERY_AND_OPERATOR_LOCK_V1_COMPLETED_CANONICAL_PR83; CAREER_OS_PERSONAL_V1_DIRECTION_LOCKED; CAREER_OS_OPERATOR_V1_INSTALLED) -- NEXT_CANDIDATE CANONICAL_GOLD_SOURCES_V1 SELECTED_NOT_AUTHORIZED -- HISTORICAL_SUPERSEDED_ROUTING: SUPERVISED_PRODUCTION_V1 (ACTIVE_PRODUCTION_DOCTRINE; SLICE_1_COMPLETED_BY_OPERATOR_BORA_ACCEPTED; SLICE_2_COMPLETED_BY_OPERATOR_BORA_ACCEPTED; FIRST_PARTY_IDENTITY_RESOLUTION_V1_COMPLETED_BY_OPERATOR_BORA_ACCEPTED_PR82; CAREER_OS_PERSONAL_V1_DIRECTION_LOCKED; CAREER_OS_OPERATOR_V1_INSTALLED) -- NEXT_BOUNDED_ACTION CANONICAL_GOLD_SOURCES_V1 -- HISTORICAL_SUPERSEDED_ROUTING: SUPERVISED_PRODUCTION_V1 (ACTIVE_PRODUCTION_DOCTRINE; SLICE_1_COMPLETED_BY_OPERATOR_BORA_ACCEPTED; SLICE_2_COMPLETED_BY_OPERATOR_BORA_ACCEPTED; PRODUCTION_EVIDENCE_ACTIVE) -- COMPLETED_SEAM SUPERVISED_PRODUCTION_V1_SLICE_2_GATES_MATCH_TRUTH_TO_SHEET -- NEXT_CANDIDATE_SEAM SUPERVISED_PRODUCTION_V1_FIRST_PARTY_IDENTITY_RESOLUTION_V1 SELECTED_NOT_AUTHORIZED -- HISTORICAL_ACCEPTED_BASELINE: CAREER_OS_ASSURANCE_TIMING_OBSERVABILITY_V1 (PHASE H) (COMPLETED_BY_OPERATOR; BORA_ACCEPTED (2026-09-15); BOUNDED_IMPLEMENTATION) -- CAREER_OS_MILESTONE_RUN_V1_TARGETED_OPTIMIZATION_V1 (COMPLETED_BY_OPERATOR; BORA_ACCEPTED (2026-09-15); PRIOR_IMPLEMENTATION_AUTHORITY_SCOPED_TO_THIS_MILESTONE_ONLY_NOT_GLOBAL_EXHAUSTED_BY_OPERATOR_COMPLETION)",
  "next_authorized_action": "CURRENT: CANONICAL_GOLD_SOURCES_V1 is the selected next bounded candidate from the locked Career OS Personal V1 execution order. This closure sync does not authorize mutation: first define the smallest bounded Gold-source canonicalization contract using the already verified source artifacts/hashes, validate/review that contract, and obtain/record bounded authority before moving/copying or wiring production retrieval. Runtime implementation remains unauthorized by this closure sync. Recommendation C remains NOT_AUTHORIZED. Phase I and every later roadmap phase remain PROPOSED_NOT_AUTHORIZED. Do not reconstruct Gold artifacts or redesign Candidate Truth, Match Truth, first-party identity, storage architecture, package semantics, or submission policy. Global implementation_authorized remains false. HISTORICAL_ACCEPTED_CONTEXT_ONLY_NOT_CURRENT_AUTHORITY: CURRENT: complete and promote CAREER_OS_PERSONAL_V1_RECOVERY_AND_OPERATOR_LOCK_V1; after canonical merge/recovery, the next bounded product step is CANONICAL_GOLD_SOURCES_V1: make the already hash-verified Gold resume and cover-letter source binaries reliably retrievable without reconstructing or mutating them. No Candidate Truth, Match Truth, identity-runtime, database, submission-policy, or package-runtime redesign is authorized by this routing statement. Runtime implementation remains unauthorized by this governance sync except through a separately authorized bounded milestone. Recommendation C remains NOT_AUTHORIZED. Phase I and every later roadmap phase remain PROPOSED_NOT_AUTHORIZED. Global implementation_authorized remains false as a blanket flag; future runtime authority remains bounded milestone-by-milestone. HISTORICAL_ACCEPTED_CONTEXT_ONLY_NOT_CURRENT_AUTHORITY: SUPERVISED_PRODUCTION_V1_FIRST_PARTY_IDENTITY_RESOLUTION_V1 is the selected next bounded production-earned candidate seam and remains SELECTED_NOT_AUTHORIZED. Selection is grounded in PROD_20260926_FIRST_REAL_BATCH_001: five real third-party nominations correctly failed closed to five durable VERIFICATION_REQUIRED records with no JOBS rows, while first-party verification independently resolved exact employer identifiers for MTA 17407, Peraton 2026-171010, and OneMain R2608-52225 and left Middesk/Runlayer unresolved. Contract: milestone_contracts/governance/supervised-production-v1-first-party-identity-resolution-v1-contract.json. Governance/contract work only. Runtime implementation remains unauthorized until this exact contract/routing state is validated, independently reviewed, canonically merged/recovered unchanged, and Bora separately gives explicit runtime authorization. Do not weaken exact identity; do not promote discovery-platform IDs or source claims; do not start Match Truth redesign, package generation, Vercel, Scout expansion, browser automation, auto-submit, PURSUE persistence, or a database. Runtime implementation remains unauthorized. Recommendation C remains NOT_AUTHORIZED. Phase I and every later roadmap phase remain PROPOSED_NOT_AUTHORIZED. Global implementation_authorized remains false. Accepted binding Phase E executability classes remain EXECUTABLE_NOW / RECONSTRUCTION_BACKED_DESIGN_CASE / BLOCKED_CANDIDATE / HUMAN_CONFIRMED_REFERENCE. Accepted binding Phase F trace semantics: terminal_state = the outcome the run actually reached; first_point_of_divergence = the earliest identifiable divergence from correctness in the run's own trajectory, including one a later gate catches and recovers from; first_causal_failure_point = the divergence point -- that same earliest divergence, or a distinct, later one -- after which no later gate in the run's own trajectory recovered, making the incorrect terminal_state unavoidable, and first_causal_failure_point equals first_point_of_divergence only when no earlier recovered divergence exists; first_point_of_divergence = A and first_causal_failure_point = B at two different points in the same run. If a recovered first_point_of_divergence = A is followed by a later actual causal defect that is uninstrumented with no identifiable point B, first_point_of_divergence = A is preserved unchanged (never wiped or reattributed) and first_causal_failure_point is separately recorded as CAUSE_UNKNOWN / UNINSTRUMENTED_BOUNDARY rather than a fabricated point B; this remains distinct from the fully-uninstrumented case where both fields carry that same symmetric CAUSE_UNKNOWN / UNINSTRUMENTED_BOUNDARY label. a correct terminal_state with no divergence records first_point_of_divergence as NOT_APPLICABLE / NO_DIVERGENCE, and any correct terminal_state -- including one preserving a recovered first_point_of_divergence = A unchanged -- records first_causal_failure_point as NOT_APPLICABLE / NO_TERMINAL_FAILURE, never CAUSE_UNKNOWN / UNINSTRUMENTED_BOUNDARY, which remains reserved exclusively for an incorrect terminal_state with a real but uninstrumented divergence or causal failure. Global implementation_authorized remains false. HISTORICAL_ACCEPTED_CONTEXT_ONLY_NOT_CURRENT_AUTHORITY: Historical evidence only; none of the quoted status language below is a current routing instruction. OPERATE FIRST / BUILD SECOND. Historical checkpoint statement (no longer current): No new engineering milestone is selected or authorized. Global implementation_authorized remains false. Historical milestones: CAREER_OS_ASSURANCE_TIMING_OBSERVABILITY_V1 — COMPLETED_BY_OPERATOR / BORA_ACCEPTED (2026-09-15) / BOUNDED_IMPLEMENTATION; CAREER_OS_ASSURANCE_ARCHITECTURE_V1 — COMPLETED_BY_OPERATOR / BORA_ACCEPTED (2026-09-14) / READ_ONLY_DESIGN_ONLY; CAREER_OS_TRACE_AND_CONTRACT_ARCHITECTURE_V1 — COMPLETED_BY_OPERATOR / BORA_ACCEPTED (2026-09-14) / READ_ONLY_DESIGN_ONLY; CAREER_OS_SYSTEM_EVAL_SET_ARCHITECTURE_V1 — COMPLETED_BY_OPERATOR / BORA_ACCEPTED (2026-09-12) / READ_ONLY_DESIGN_ONLY; CAREER_OS_FAILURE_TAXONOMY_AND_EVALUATOR_COVERAGE_MAP_V1 — COMPLETED_BY_OPERATOR / BORA_ACCEPTED (2026-09-11) / READ_ONLY_DESIGN_ONLY; CAREER_OS_MILESTONE_RUN_V1_TARGETED_OPTIMIZATION_V1 — COMPLETED_BY_OPERATOR / BORA_ACCEPTED (2026-09-15). Historical Bora authorization quote: Done brother carry the same discipline and manner and u have my authorization to move forward ofc if all is up to the standard of the three guys we refer to love u. Historical superseded guardrail, retained only for regression provenance: No product automation, trace infrastructure, database/UI, new agents, model routing, LLM judges, Recommendation C, Phase I, or successor engineering milestone is authorized by that historical completion sync. Accepted Phase F example: first_point_of_divergence = A and first_causal_failure_point = B at two different points in the same run.",
  "semantic_state_updated_at": "2026-09-27"
}
